{
  "artifact_id": "artifact--veldoria-demo--extraction-001",
  "extraction_result_id": "extraction-001",
  "source_id": "veldoria-demo",
  "generated_at": "2026-06-16T00:00:00Z",
  "classification_candidate": {
    "ncm_code": "84322900000",
    "description": "Synthetic Veldoria demo soil tillage units are presented as a candidate classification for human review only.",
    "confidence": 0.82,
    "status": "candidate"
  },
  "extracted_evidence": [
    {
      "claim_id": "claim-001",
      "claim_type": "classification",
      "text": "The synthetic Veldoria demo nomenclature places motorized demo soil tillage units under candidate code 8432.29.00.000 for illustration.",
      "source_ref": "snapshots/pcram/demo-veldoria-evidence-packet.json#/excerpts/0",
      "confidence": 0.82,
      "affected_ncm": ["84322900000"],
      "requires_review": true
    },
    {
      "claim_id": "claim-002",
      "claim_type": "tariff",
      "text": "The synthetic demo schedule lists a fictional 7.5 percent ad valorem demo rate for the candidate heading.",
      "source_ref": "snapshots/pcram/demo-veldoria-evidence-packet.json#/excerpts/1",
      "confidence": 0.74,
      "affected_ncm": ["84322900000"],
      "requires_review": true
    },
    {
      "claim_id": "claim-003",
      "claim_type": "legal",
      "text": "All Veldoria references are fictional and require human review before any downstream use.",
      "source_ref": "docs/classifier-intelligence-artifact-p1.md#phase-6-implementation-shape",
      "confidence": 1,
      "requires_review": true
    }
  ],
  "governance": {
    "human_review_required": true,
    "downstream_allowed": false,
    "review_only": true,
    "not_final_classification": true
  },
  "schema_version": "1.0.0"
}
